{"schema_version":"1.0","audit_run_id":"20260821-v571-remediation-acceptance-rc3","claim_id":"PIPELINE-V571-PRODUCTION-001","role":"calibration_provenance","reviewed_commit":"5bb5a836e30ed0a8b4f6644e3e5f30d680f6ad4e","verdict":"fail","confidence":"high","summary":"The candidate correctly parses Leica units, resolves calibration before measurements in primary entry points, enforces the production checkpoint hash, archives major provenance inputs, and labels repeated-2D-ROI volume as non-anatomical. Acceptance is blocked because manifest-locked calibration trusts stored numeric values without re-parsing or hash-verifying the referenced XML, and batch discovery can silently broaden a failed pattern to unrelated stacks or channels without enforcing unique Z/channel identity.","checks":[{"check_id":"leica_discovery_parsing_units_fallback_order","status":"fail","evidence":["sperm_segmentation_saturnv5.7.1.py:11066-11155 parses explicit X/Y/Z Leica dimensions, converts declared units, rejects incomplete dimensions and X/Y disagreement, and calculates Z spacing using count-1.","sperm_segmentation_saturnv5.7.1.py:11297-11472 resolves calibration before use and fails when required discoverable Leica metadata is unavailable.","sperm_segmentation_saturnv5.7.1.py:11343-11370 accepts manifest-locked numeric calibration after checking only XML existence and positivity; it does not parse the XML or verify a retained XML hash.","tests/test_saturn_v571_audit_blockers.py:297-323 demonstrates the weakness by accepting an XML containing only <xml/> as manifest-locked Leica calibration."]},{"check_id":"image_roi_exclusion_z_channel_checkpoint_profile_alignment","status":"fail","evidence":["sperm_segmentation_saturnv5.7.1.py:8142-8158 shape-checks and applies the configured ROI and exclusion mask.","sperm_segmentation_saturnv5.7.1.py:1039-1087 silently falls back from a failed requested pattern to every supported image in the directory and assigns/extracts Z indices without validating a single stack, channel, or unique Z sequence.","sperm_segmentation_saturnv5.7.1.py:8125-8127 converts the resulting files into a files_by_z dictionary, so duplicate Z values from multiple channels can overwrite one another.","sperm_segmentation_saturnv5.7.1.py:10884-10897 defines conservative channel-aware study parsing, but load_batch_files does not use it for batch fallback validation."]},{"check_id":"checkpoint_hash_and_settings_manifest","status":"pass","evidence":["Read-only Python SHA-256 calculation returned 7d49031dbcce31f0600c44146d9b5282b0df6e28bb1fc1bdde6ef2146ed15d25 for model_checkpoints/v571_model_c_dual_head_epoch003.pt, matching production_profiles/saturn_v5_7_1_model_c_epoch003.json UNET_CHECKPOINT_SHA256.","sperm_segmentation_saturnv5.7.1.py:783-820 computes and enforces the configured checkpoint SHA-256.","sperm_segmentation_saturnv5.7.1.py:11538-11744 copies runtime parameters, environment, profile, checkpoint, calibration, metadata, masks, and source-image manifest, recording size and SHA-256 in settings_manifest.json."]},{"check_id":"repeated_2d_roi_volume_terminology","status":"pass","evidence":["sperm_segmentation_saturnv5.7.1.py:13116-13121 explicitly states that the volume denominator repeats the same 2D ROI through nominal stack depth and is not anatomical tissue, seminal-vesicle, or whole-organ volume.","audits/V5_7_1_DESIGN_DECISIONS.md:64-65 states the same limitation."]},{"check_id":"generated_artifact_reproducibility","status":"pass","evidence":["sperm_segmentation_saturnv5.7.1.py:11616-11681 archives the applied profile, checkpoint, resolved calibration, and Leica XML with hashes.","sperm_segmentation_saturnv5.7.1.py:11683-11731 archives ROI/exclusion sources and an ordered source-image manifest containing path, name, size, SHA-256, Z, channel, stack key, and shape.","sperm_segmentation_saturnv5.7.1.py:7981-7988 and 8125-8134 resolve calibration and capture source/settings provenance before segmentation or measurement in single and batch workflows."]},{"check_id":"focused_automated_tests","status":"not_verified","evidence":["Command `python -m pytest -q tests/test_saturn_v571_audit_blockers.py tests/test_saturn_v57_multisample.py -k \"calibration or settings_bundle or provenance or manifest_locked or anatomical\"` could not run because the active Python environment reports `No module named pytest`.","Static inspection of named tests was performed; no other reviewers' outputs were read."]}],"findings":[{"severity":"blocking","title":"Manifest-locked Leica calibration is not bound to XML identity or contents","impact":"A stale, replaced, malformed, or mismatched Leica XML can exist while the pipeline silently applies numeric XY/Z values retained in a manifest. The subsequently archived XML hash proves only which file was copied, not that the applied calibration was derived from that file. This violates the authoritative hashed mapping requirement and can corrupt every physical measurement and threshold.","evidence":["sperm_segmentation_saturnv5.7.1.py:11343-11370 checks only metadata-file existence and positive stored values before returning status leica_xml_manifest_locked.","sperm_segmentation_saturnv5.7.1.py:12295-12319 similarly validates only metadata existence and positivity of manifest calibration values.","tests/test_saturn_v571_audit_blockers.py:297-323 supplies <xml/> and still expects manifest-locked calibration to succeed.","sperm_segmentation_saturnv5.7.1.py:11674-11681 hashes the copied XML only during output archiving, after calibration values have already been trusted."],"recommendation":"Store the authoritative XML SHA-256 and source-to-XML mapping in the study manifest. Before analysis, verify the XML hash, re-parse its calibration, and require agreement with locked XY/Z values within a declared tolerance. Fail closed on malformed, replaced, ambiguous, or mismatched metadata; add adversarial tests for each case."},{"severity":"blocking","title":"Batch fallback can mix channels or unrelated stacks and overwrite duplicate Z planes","impact":"If the configured glob has a typo or extension mismatch beyond the narrow substitution, the production batch path can ingest every supported image in the folder. Multiple channels or stacks can then share Z indices; files_by_z silently retains only one path per Z, causing source, channel, context-plane, and calibration misalignment.","evidence":["sperm_segmentation_saturnv5.7.1.py:1066-1075 broad-scans all supported images when the requested pattern finds nothing.","sperm_segmentation_saturnv5.7.1.py:1080-1087 returns extracted Z indices without rejecting duplicate Z, mixed channel, mixed stack, or unparseable identity.","sperm_segmentation_saturnv5.7.1.py:8125-8127 constructs files_by_z with dictionary overwrite semantics.","sperm_segmentation_saturnv5.7.1.py:10884-10897 provides stricter study filename parsing but it is not applied by load_batch_files."],"recommendation":"Remove the unrestricted production fallback or filter fallback candidates through the conservative parser and the requested stack/channel identity. Require one stack key, one channel, unique ordered Z indices, consistent shapes, and an unambiguous metadata match before calibration or inference; fail closed otherwise."}],"limitations":["No full image stack was run, as instructed.","Focused pytest execution was unavailable because pytest is not installed in the active Python environment.","Working tree contained an untracked audits/runs/20260821-v571-remediation-acceptance-rc3 directory; it was not read because it may contain other reviewers' outputs.","Review was limited to calibration, source identity, alignment, checkpoint/profile provenance, ROI semantics, and reproducibility artifacts."],"recommended_follow_up":["Remediate both blocking findings and create a superseding audit run.","Add tests proving manifest-locked calibration rejects changed-hash, malformed, wrong-series, and numeric-mismatch XML.","Add batch discovery tests with ch00/ch01 coexistence, two Leica series, duplicate Z indices, and a misspelled pattern; all must fail before inference.","Run the focused calibration/provenance test set in a documented environment with pytest available."]}