{
  "schema_version": "1.0",
  "audit_run_id": "20260827-v571-remediation-acceptance-rc6",
  "claim_id": "PIPELINE-V571-PRODUCTION-001",
  "role": "measurement_geometry",
  "reviewed_commit": "cfd0f3ff0927fae2ed5e34849048c02ca94c6a80",
  "verdict": "pass",
  "confidence": "high",
  "summary": "Measurement geometry and RC5 remediation evidence are sufficient for acceptance in the reviewed clean worktree. The primary body-width path uses ordered centerlines, contour chords, endpoint trimming, explicit unavailable behavior, calibrated units, and specimen-level sensitivity reporting.",
  "checks": [
    {
      "check_id": "reviewed_commit_and_worktree",
      "status": "pass",
      "evidence": [
        "Command `git rev-parse HEAD` returned `cfd0f3ff0927fae2ed5e34849048c02ca94c6a80` in `C:\\tmp\\saturn-v571-final-audit`.",
        "Command `git status --porcelain=v1` returned no entries; `git diff --check` passed.",
        "`audits/validation/v571_6f9e73b_validation.md` records RC6 evidence provenance validation as passed."
      ]
    },
    {
      "check_id": "body_width_geometry",
      "status": "pass",
      "evidence": [
        "`sperm_segmentation_saturnv5.7.1.py:3387-3458` measures perpendicular contour chords through an ordered, smoothed, arc-length-resampled centerline, trims endpoints, summarizes median/P90/IQR, and returns unavailable when valid chord samples are below the configured minimum.",
        "`sperm_segmentation_saturnv5.7.1.py:3326-3350` orders centerline coordinates with `extract_geodesic_centerline_coords` before smoothing and resampling.",
        "`tests/test_saturn_v571_body_width.py:59-73` tests known-width rotation stability; `:76-99` tests tapered-endpoint handling; `:139-150` tests unavailable width behavior for insufficient samples."
      ]
    },
    {
      "check_id": "legacy_and_representative_plane_fields",
      "status": "pass",
      "evidence": [
        "`tests/test_saturn_v571_body_width.py:102-135` verifies explicit legacy EDT fields alongside the new body-width fields.",
        "`sperm_segmentation_saturnv5.7.1.py:5116-5201` selects representative width by largest filled-mask area, then support, then lowest Z, and propagates missing values rather than fabricating them.",
        "`tests/test_saturn_v571_body_width.py:153-200` covers largest-area selection and tie-breaking."
      ]
    },
    {
      "check_id": "calibration_and_physical_units",
      "status": "pass",
      "evidence": [
        "`audits/evidence/v571_rc6_candidate/provenance/acceptance_provenance_manifest.json:5-6,68-72,126-132` retains per-specimen calibration and artifact hashes.",
        "`audits/evidence/v571_rc6_candidate/provenance/specimens/kj_sv_40xx0.75-1/settings/calibration_used.json` and the corresponding WT calibration artifact retain resolved Leica calibration values.",
        "`audits/evidence/v571_rc6_candidate/report/02_quality_control/data/specimen_sensitivity_artifact.json:10-15,39` defines calibrated area and sampled-volume formulas separately."
      ]
    },
    {
      "check_id": "rc5_provenance_remediation",
      "status": "pass",
      "evidence": [
        "`audits/validation/v571_6f9e73b_validation.md` states evidence binding passed using canonical Git-blob hashes and records RC6 remediation for content binding.",
        "`audits/evidence/v571_rc6_candidate/stages/visual_evidence_manifest.json:3-9` and `audits/evidence/v571_rc6_candidate/tracking/tracking_replay_manifest.json:3-10` retain generation commit and pipeline/profile/generator blob hashes.",
        "Command comparison of `git hash-object` and `git rev-parse HEAD:<path>` matched for `sperm_segmentation_saturnv5.7.1.py`, the production profile, and `scripts/generate_specimen_sensitivity_artifact.py` at the reviewed commit."
      ]
    },
    {
      "check_id": "explicit_channel_provenance",
      "status": "pass",
      "evidence": [
        "`audits/evidence/v571_rc6_candidate/provenance/specimens/kj_sv_40xx0.75-1/settings/source_image_manifest.json:2-21` records 88 ordered images, explicit filename channel resolution, and accepted channel `ch00`.",
        "`audits/evidence/v571_rc6_candidate/provenance/specimens/w1118_sv_feb_40xx0.75-1/settings/source_image_manifest.json` records 67 ordered images with the same explicit `ch00` rule.",
        "Focused JSON parse reported unique channel `0` for both manifests."
      ]
    },
    {
      "check_id": "specimen_level_sensitivity",
      "status": "pass",
      "evidence": [
        "`audits/evidence/v571_rc6_candidate/report/02_quality_control/data/specimen_sensitivity_artifact.json:3-20` identifies `biological_specimen` as the analysis unit, disables group inference, and separates primary, upper-bound, width-missingness, area, and sampled-volume interpretations.",
        "The same artifact reports 35 specimens, 2 included, and 33 excluded or missing at `:7-9`, retaining excluded specimens in the ledger."
      ]
    }
  ],
  "findings": [],
  "limitations": [
    "Independent pytest execution was not repeated because the detached worktree has no `.venv`; retained RC6 validation reports 225 passed tests and the focused source/test inspection was completed read-only.",
    "The reviewed evidence supports sampled ROI area and sampled ROI slab volume only; it does not establish anatomical seminal-vesicle volume or biological group effects."
  ],
  "recommended_follow_up": [
    "Retain the RC6 provenance and focused geometry test artifacts with the release audit record.",
    "Keep anatomical-volume claims unavailable unless slice-specific 3D organ masks are independently reviewed."
  ]
}
