{"schema_version":"1.0","audit_run_id":"20260821-v571-remediation-acceptance-rc3","claim_id":"PIPELINE-V571-PRODUCTION-001","role":"biological_validity","reviewed_commit":"5bb5a836e30ed0a8b4f6644e3e5f30d680f6ad4e","verdict":"fail","confidence":"high","summary":"The acceptance candidate correctly separates most morphology warnings from technical failures, avoids WT-reference scoring in comparative tuning, uses specimen-level reporting, and labels repeated-2D-ROI volume appropriately. However, production tracking still imposes a hard 20 um reconstructed-length join veto. Length alone can therefore fragment genuine nuclei above 20 um, contradicting the claimed morphology-neutral tracking semantics and the design rule that length above 20 um is insufficient for technical intervention. This blocks biological-validity acceptance.","checks":[{"check_id":"technical_invalid_vs_morphology_warning","status":"pass","evidence":["sperm_segmentation_saturnv5.7.1.py:6968-7012 assigns length-width ratio and other morphology conditions to morphology masks while reserving objective leakage, ROI/exclusion overlap, clear multi-object merge, and tracking inconsistency for technical masks.","sperm_segmentation_saturnv5.7.1.py:7053-7085 makes technical_valid depend only on technical masks in comparative mode and retains morphology-warning tracks as biological candidates.","tests/test_saturn_v571_audit_blockers.py:25-63 asserts that an object above 20 um remains technical-valid with a long morphology warning.","tests/test_saturn_v571_audit_blockers.py:66-93 distinguishes a branched multi-object component from a smooth long object." ]},{"check_id":"wt_reference_not_acceptance_or_tuning_target","status":"pass","evidence":["production_profiles/saturn_v5_7_1_model_c_epoch003.json:2 sets ANALYSIS_MODE to comparative.","utils/tune_parameters_Saturnv5_7_1.py:657-664 calculates a morphology-prior diagnostic, but utils/tune_parameters_Saturnv5_7_1.py:692-695 excludes it from comparative scoring.","sperm_segmentation_saturnv5.7.1.py:7059-7084 keeps reference_morphology_pass as a diagnostic subset while defining the primary biological candidate from technical_valid.","tests/test_saturn_v571_dual_head.py:49-81 checks that comparative U-Net-primary scores do not penalize short or long morphology." ]},{"check_id":"plausible_morphology_case_coverage","status":"pass","evidence":["tests/test_saturn_v571_audit_blockers.py:96-132 covers long straight, wide, thin, and curved single-core masks and requires them to remain single instances.","tests/test_saturn_v57_multisample.py:223-298 covers high-confidence short and low-ratio nuclei.","tests/test_saturn_v57_unet_primary_tracking.py:97-100 and tests/test_saturn_v57_unet_primary_tracking.py:266-289 cover single-slice accounting and warning-bearing tracking.","tests/test_saturn_v571_audit_blockers.py:135-171 covers fused-looking objective learned-core evidence and mask-preserving splitting.","tests/test_saturn_v57_multisample.py:468-491 covers avoiding fragmentation of an already represented U-Net instance." ]},{"check_id":"thresholds_preserve_studied_phenotype","status":"fail","evidence":["production_profiles/saturn_v5_7_1_model_c_epoch003.json:163 and production_profiles/saturn_v5_7_1_model_c_epoch003.json:197 set both applicable reconstructed/joined-length guards to 20.0 um.","sperm_segmentation_saturnv5.7.1.py:4883-4895 selects UNET_TRACK_MAX_RECONSTRUCTED_LENGTH_UM as the comparative U-Net-primary hard join limit.","sperm_segmentation_saturnv5.7.1.py:4930-4942 rejects an extension solely when estimated joined length exceeds that limit.","sperm_segmentation_saturnv5.7.1.py:5836-5846 applies the same length-only veto in global assignment.","tests/test_saturn_v57_multisample.py:201-221 verifies preservation only in the 15-20 um band, not biologically plausible tracks above 20 um." ]},{"check_id":"sampled_roi_vs_whole_organ_language","status":"pass","evidence":["sperm_segmentation_saturnv5.7.1.py:12430-12442 names the denominator sampled_roi_volume_um3.","sperm_segmentation_saturnv5.7.1.py:13109-13121 explicitly describes sampled ROI area and repeated-2D-ROI nominal volume and states that the latter is not anatomical tissue, seminal-vesicle, or whole-organ volume.","audits/claims_registry.json:49-53 records anatomical SV volume and genotype effect as non-claims or limitations." ]},{"check_id":"biological_conclusion_limits","status":"pass","evidence":["V5_7_1_VALIDATION_REPORT.md:83 states that one specimen per group is not a genotype inference.","sperm_segmentation_saturnv5.7.1.py:12808-12814 warns when groups have fewer than three or five independent specimens.","sperm_segmentation_saturnv5.7.1.py:13099-13101 says specimen panels do not by themselves prove a biological mechanism.","audits/claims_registry.json:52-53 explicitly disclaims a KJ-versus-WT biological effect from the pilot and anatomical SV-volume measurement." ]}],"findings":[{"severity":"blocking","title":"Comparative tracking uses phenotype length as a hard technical veto above 20 um","impact":"A genuine nucleus whose reconstructed length exceeds 20 um can be split into multiple tracks even when spatial, overlap, orientation, and learned support are compatible. Source detections remain present, but fragmentation changes nucleus counts, track-level length and Z-span, and specimen summaries in a morphology-dependent way. This contradicts the claim that plausible long mutant morphology remains measurable and that global tracking is morphology-neutral.","evidence":["production_profiles/saturn_v5_7_1_model_c_epoch003.json:197 sets UNET_TRACK_MAX_RECONSTRUCTED_LENGTH_UM to 20.0.","sperm_segmentation_saturnv5.7.1.py:4883-4895 selects that threshold specifically for comparative U-Net-primary tracking.","sperm_segmentation_saturnv5.7.1.py:4930-4942 rejects an otherwise proposed extension solely for exceeding the length threshold.","sperm_segmentation_saturnv5.7.1.py:5836-5846 repeats the length-only rejection in global assignment.","audits/V5_7_1_DESIGN_DECISIONS.md:13-16 states that length above 20 um is insufficient for deletion or splitting and requires objective fusion or merge evidence."],"recommendation":"Remove reconstructed biological length as a standalone comparative tracking veto. Reject joins using objective multi-object or impossible-motion evidence, retain supported long tracks with morphology warnings, and add adversarial tests for compatible tracks crossing 20 um without objective fusion evidence."},{"severity":"medium","title":"Automated morphology coverage does not validate the production model against biological ground truth","impact":"Synthetic masks establish code semantics but cannot show that the trained foreground/core heads preserve genuine fragmented-looking, fused-looking, or extreme mutant nuclei in microscopy data. Production readiness remains dependent on external biological validation of manual masks from independent specimens.","evidence":["tests/test_saturn_v571_audit_blockers.py:96-171 uses constructed NumPy masks and synthetic probability/core maps.","V5_7_1_VALIDATION_REPORT.md:36-51 describes configuration comparisons on named KJ and WT specimens but does not cite blinded manual-mask sensitivity or instance-level biological ground truth.","audits/claims_registry.json:52 states that the available pilot cannot establish a KJ-versus-WT biological effect."],"recommendation":"Before making biological sensitivity or phenotype-preservation claims, evaluate blinded manual instance masks from multiple independent WT and mutant specimens, stratified by short, long, wide, thin, curved, fragmented-looking, fused-looking, single-slice, and low-ratio morphology."}],"limitations":["No full image stack was run, as required by the review instructions.","Focused pytest execution could not start because the read-only environment provided no writable temporary directory; pytest raised FileNotFoundError before collection. Test source and committed validation artifacts were inspected instead.","No other reviewers' outputs were read.","This review establishes implementation semantics and evidence boundaries, not biological sensitivity or specificity against new manual ground truth."],"recommended_follow_up":["Replace the 20 um length-only tracking veto with objective technical evidence and rerun the biological-validity audit.","Add a synthetic compatible >20 um multi-slice track test requiring one retained technical-valid track, plus an objective-fusion counterexample requiring rejection without source-detection deletion.","Run the focused biological/adversarial tests in a writable isolated test environment and archive the command result.","Obtain blinded manual-mask validation across independent specimens before drawing phenotype-preservation or genotype conclusions."]}