{"schema_version":"1.0","audit_run_id":"20260828-v571-body-width-acceptance-rc2","claim_id":"MEAS-BODY-WIDTH-001","role":"statistics_reporting","reviewed_commit":"fc3aed7b4646fcef1e1e0aaf65fd981ed48db4ef","verdict":"fail","confidence":"high","summary":"The primary body-width estimand is clearly defined as the median representative-plane apparent body width among technically valid nuclei, summarized once per biological specimen. Commit-bound outputs correctly suppress inference for the one-specimen-per-group candidate, preserve missing-width diagnostics in technical QC, separate count and density denominators, and pass cross-format numeric validation. Acceptance is blocked because the report generator still infers the reference group from hard-coded control/WT/w1118 genotype tokens when explicit group direction is omitted, contrary to the required reporting check.","checks":[{"check_id":"estimand_and_statistical_unit","status":"pass","evidence":["scripts/generate_v57_biological_comparison.py:52-61 defines the biological question and the specimen-median apparent-body-width estimand.","scripts/generate_v57_biological_comparison.py:223-244 extracts one metric value per specimen and requires at least three specimens in each group for inference.","scripts/generate_v57_biological_comparison.py:285-298 records analysis_unit as biological specimen and reports specimen counts.","audits/evidence/v571_rc6_candidate/report/01_biological_results/data/biological_statistical_tests.csv:3 reports median_body_width_um with analysis_unit=biological specimen, inference_status=insufficient_specimens, and n=1 per group."]},{"check_id":"nested_nuclei_and_specimen_level_inference","status":"pass","evidence":["sperm_segmentation_saturnv5.7.1.py:7313-7317 restricts the primary nucleus table to technical_valid tracks.","sperm_segmentation_saturnv5.7.1.py:7345-7361 computes the specimen body-width median from representative_body_width_um while retaining the legacy EDT median separately.","scripts/generate_v57_biological_comparison.py:923-927 explicitly states that nuclei are nested measurements and are not independent replicates.","Focused command `.\\.venv\\Scripts\\python.exe -m pytest -q -s -p no:cacheprovider tests/test_saturn_v571_body_width.py tests/test_tuner_v571_body_width.py tests/test_v57_biological_comparison.py` completed with 22 passed in 18.99s."]},{"check_id":"formulas_denominators_missingness_multiplicity_effects_ci_sensitivity","status":"pass","evidence":["scripts/generate_v57_biological_comparison.py:238-264 defines the comparison-minus-reference median difference, specimen bootstrap interval, and two-sided permutation test.","scripts/generate_v57_biological_comparison.py:265-320 provides Mann-Whitney and Welch sensitivity tests, Cliff's delta, Hedges g, and a guarded percent-difference denominator.","scripts/generate_v57_biological_comparison.py:332-339 applies Benjamini-Hochberg correction separately to the permutation, Mann-Whitney, and Welch test families.","sperm_segmentation_saturnv5.7.1.py:12855-12879 computes the specimen median from available representative widths and records body_width_available_fraction.","sperm_segmentation_saturnv5.7.1.py:13577-13612 records width-available counts, missing fractions, and a sensitivity analysis excluding below-2-um tracks while retaining those tracks in the primary population.","audits/evidence/v571_rc6_candidate/report/02_quality_control/data/below_2_um_specimen_sensitivity.csv:1 exposes primary and sensitivity width availability and missingness fields.","audits/evidence/v571_rc6_candidate/report/01_biological_results/data/biological_statistical_tests.csv:3 leaves confidence intervals, effect sizes, p-values, and q-values unavailable when each group contains only one specimen."]},{"check_id":"cross_format_numeric_agreement","status":"pass","evidence":["audits/evidence/v571_rc6_candidate/report/01_biological_results/data/report_consistency_validation.json records status=pass, source_csv_matches_contract=true, excel_matches_contract=true, and pdf_contains_contract_tokens=true.","audits/evidence/v571_rc6_candidate/report/01_biological_results/data/report_numeric_contract.json records the body-width source values WT=1.6921 and KJ=1.5523 and the corresponding PDF token.","scripts/generate_v57_biological_comparison.py:1524-1556 writes the workbook and validates the CSV, workbook, and PDF against the numeric contract."]},{"check_id":"count_volume_density_separation","status":"pass","evidence":["scripts/generate_v57_biological_comparison.py:21-40 defines area density and sampled-volume density as distinct exploratory outcomes with different biological meanings.","sperm_segmentation_saturnv5.7.1.py:12821-12828 emits raw estimated nuclei, nuclei per 1,000 um2, and nuclei per 100,000 um3 as separate fields.","audits/evidence/v571_rc6_candidate/report/02_quality_control/data/specimen_technical_qc.csv:1 contains separate estimated_unique_nuclei, estimated_nuclei_per_1000_um2, estimated_nuclei_per_100000_um3, roi_area_um2, and sampled_roi_volume_um3 columns."]},{"check_id":"primary_vs_legacy_width_reporting","status":"pass","evidence":["sperm_segmentation_saturnv5.7.1.py:7319-7333 maps representative_body_width_um to the primary body_width_um field and explicitly labels median_width_2d as width_um_dt_median_legacy.","sperm_segmentation_saturnv5.7.1.py:7350-7363 keeps median_body_width_um and median_width_um_dt_legacy separate.","scripts/generate_v57_biological_comparison.py:52-61 includes median_body_width_um as the biological morphology metric; no legacy EDT-width metric appears in the primary METRICS definition.","tests/test_saturn_v571_body_width.py:230-245 verifies that the specimen primary body-width median and legacy EDT median remain distinct."]},{"check_id":"genotype_labels_and_qc_terminology","status":"fail","evidence":["scripts/generate_v57_biological_comparison.py:134-143 selects a reference group by matching hard-coded tokens control, reference, wild, w1118, WT, and ctrl.","scripts/generate_v57_biological_comparison.py:1193-1203 invokes this label-based inference whenever --reference-group is absent and describes the source as frozen v5.7 legacy label inference.","tests/test_v57_biological_comparison.py:45 explicitly tests and preserves the hard-coded control-label behavior.","audits/evidence/v571_rc6_candidate/report/01_biological_results/data/report_numeric_contract.json records WT as reference and KJ as comparison but does not establish that this direction came from explicit study-role metadata rather than label inference."]}],"findings":[{"severity":"blocking","title":"Primary report can infer group direction from hard-coded genotype labels","impact":"A report generated without explicit group arguments silently interprets labels such as WT, w1118, wild, or control as the reference group. This embeds genotype semantics in reporting, can reverse signed effects for differently named studies, and violates the explicit requirement to reject hard-coded genotype labels in primary biological reports.","evidence":["scripts/generate_v57_biological_comparison.py:134-143","scripts/generate_v57_biological_comparison.py:1193-1203","tests/test_v57_biological_comparison.py:45"],"recommendation":"Require explicit reference/comparison arguments or validated study-role metadata for every primary report. Remove label-token inference from the v5.7.1 reporting path, fail closed when direction is absent, add adversarial neutral-label tests, and generate a superseding commit-bound report receipt."}],"limitations":["No full image stack was run, as requested.","Focused pytest initially could not initialize capture because the read-only environment had no writable temporary directory; rerunning with `-s -p no:cacheprovider` completed successfully.","Cross-format agreement was assessed from the commit-bound validation receipt and numeric contract rather than regenerating the PDF or workbook.","Other reviewers' outputs were not read."],"recommended_follow_up":["Replace genotype-token reference inference with explicit study-role resolution and add failure tests for missing or ambiguous direction.","Regenerate the acceptance-candidate biological report and consistency receipt from the corrected reporting path.","Start a superseding append-only audit run for MEAS-BODY-WIDTH-001."]}