{"schema_version":"1.0","audit_run_id":"20260827-v571-body-width-acceptance-final","claim_id":"MEAS-BODY-WIDTH-001","role":"measurement_geometry","reviewed_commit":"1ac87a958cb6ff3b83588617e48e40b1e8035c19","verdict":"pass","confidence":"high","summary":"The claim is supported. The implementation measures median subpixel contour chords perpendicular to an ordered, smoothed, endpoint-trimmed centerline through the filled instance mask. Coordinate ordering and units are consistent, insufficient samples remain unavailable, representative track width comes from the largest-area eligible observed plane, legacy EDT measurements remain explicitly labelled, and primary tables and reports use the chord-width field. Eleven focused synthetic and reporting tests passed in the validated virtual environment. This quantity establishes apparent segmented-mask width only; it does not establish a PSF-corrected, molecular-scale, or true three-dimensional nuclear diameter.","checks":[{"check_id":"geometry_and_coordinate_trace","status":"pass","evidence":["sperm_segmentation_saturnv5.7.1.py:3306-3323 extracts the longest 0.5-level mask contour and retains global row,column coordinates.","sperm_segmentation_saturnv5.7.1.py:3326-3357 orders, smooths, and arc-length-resamples centerline row,column coordinates with linear interpolation.","sperm_segmentation_saturnv5.7.1.py:3360-3384 intersects normal lines with contour segments using the same row,column ordering and selects the nearest enclosing intersections on opposite sides.","sperm_segmentation_saturnv5.7.1.py:3414-3457 trims centerline endpoints by calibrated arc-length fraction, calculates local perpendiculars, requires positive finite chords, and summarizes their median, P90, and IQR."]},{"check_id":"known_geometry_rotation_and_adversarial_tests","status":"pass","evidence":["tests/test_saturn_v571_body_width.py:40-73 constructs known-width rectangles at 0, 20, 45, 70, and 90 degrees and requires median width within 0.8 px and P90 within 1.0 px.","tests/test_saturn_v571_body_width.py:76-99 exercises a tapered-end polygon and verifies endpoint trimming recovers its central width.","Command `.venv\\Scripts\\python.exe -m pytest -q -s -p no:cacheprovider tests/test_saturn_v571_body_width.py` completed with `11 passed in 9.10s`."]},{"check_id":"units_and_calibration","status":"pass","evidence":["sperm_segmentation_saturnv5.7.1.py:3515-3529 computes the geometric width and length/width ratio in pixels before physical export.","sperm_segmentation_saturnv5.7.1.py:4804-4825 converts body-width median, P90, IQR, and area/length cross-check from pixels with the resolved UM_PER_PX_XY scalar while preserving NaN.","sperm_segmentation_saturnv5.7.1.py:11181-11258 resolves Leica X/Y voxel dimensions, rejects X/Y anisotropy above 2%, and records the averaged near-isotropic XY scale.","sperm_segmentation_saturnv5.7.1.py:11467-11502 verifies manifest calibration against a SHA-256-bound Leica XML and fails on disagreement.","tests/test_saturn_v571_body_width.py:102-136 traces a synthetic mask through U-Net-primary measurement and calibrated row export."]},{"check_id":"missing_value_and_minimum_sample_behavior","status":"pass","evidence":["sperm_segmentation_saturnv5.7.1.py:3391-3413 initializes width summaries as NaN and returns them when the path or contour is inadequate.","sperm_segmentation_saturnv5.7.1.py:3442-3447 retains the observed valid-chord count but returns unavailable width when it is below BODY_WIDTH_MIN_SAMPLES.","tests/test_saturn_v571_body_width.py:139-150 verifies that a two-point centerline produces NaN width rather than a fabricated value."]},{"check_id":"representative_plane_selection","status":"pass","evidence":["sperm_segmentation_saturnv5.7.1.py:5116-5176 admits only finite positive widths, optionally requires the centerline to lie within the instance mask, and selects by descending filled-mask area, descending U-Net support, then lowest Z.","sperm_segmentation_saturnv5.7.1.py:5178-5201 propagates the selected plane's width statistics, Z index, sample count, and method to the track summary.","tests/test_saturn_v571_body_width.py:153-180 verifies that the largest-area plane is selected instead of the widest plane.","tests/test_saturn_v571_body_width.py:183-200 verifies deterministic support and Z tie-breaking."]},{"check_id":"field_versioning_and_primary_reporting","status":"pass","evidence":["sperm_segmentation_saturnv5.7.1.py:3564-3574 retains width_px_dt_median_legacy and length_width_ratio_dt_legacy separately from the new body-width fields.","sperm_segmentation_saturnv5.7.1.py:4747-4749 and 4787-4825 explicitly distinguish primary body_width_um from width_um_dt_median_legacy.","sperm_segmentation_saturnv5.7.1.py:7290-7341 exports representative_body_width_um as body_width_um and confines the EDT measurement to an explicitly legacy column.","sperm_segmentation_saturnv5.7.1.py:7357-7363 documents the primary width's largest-area-plane selection and segmentation, focus, and PSF limitations.","sperm_segmentation_saturnv5.7.1.py:9282-9304 filters reports to technical-valid tracks and displays representative body-mask width rather than legacy EDT width.","tests/test_saturn_v571_body_width.py:203-226 verifies primary summary-field selection and legacy labelling."]},{"check_id":"commit_bound_validation","status":"pass","evidence":["`git rev-parse HEAD` returned reviewed commit 1ac87a958cb6ff3b83588617e48e40b1e8035c19.","`git diff 6f9e73b170db121460ab82f28542d1ed1e8f96bb..1ac87a958cb6ff3b83588617e48e40b1e8035c19 -- sperm_segmentation_saturnv5.7.1.py tests/test_saturn_v571_body_width.py` showed no changes to the body-width implementation or focused tests; displayed differences were confined to later study/report sensitivity logic.","audits/validation/v571_6f9e73b_validation.md records 237 passing tests in the validated virtual environment and identifies the production pipeline Git-blob SHA-256.","The current focused command independently completed with 11 passing tests."]},{"check_id":"biological_scope","status":"pass","evidence":["audits/claims_registry.json:74-108 defines the measurement as apparent central-body mask width and explicitly disclaims true molecular-scale width.","sperm_segmentation_saturnv5.7.1.py:7359-7363 states that the width inherits annotation-boundary, threshold, focus, and PSF bias and is not a PSF-corrected physical diameter.","sperm_segmentation_saturnv5.7.1.py:9228-9234 describes the field as apparent optical mask width and keeps historical EDT width as legacy QC."]}],"findings":[{"severity":"note","title":"Near-isotropic XY calibration is represented by one averaged scale","impact":"Leica X and Y voxel sizes differing by at most 2% are averaged, so physical widths can retain a small orientation-dependent scale error even though larger anisotropy fails closed. This does not materially undermine the tested rotation-stability criterion but bounds its physical interpretation.","evidence":["sperm_segmentation_saturnv5.7.1.py:11246-11258 rejects X/Y differences above 2% and averages accepted X and Y scales.","tests/test_saturn_v571_body_width.py:58-73 tests raster-orientation stability with isotropic pixels."],"recommendation":"Retain the current fail-closed threshold and document the possible residual scale error; use separate X/Y physical coordinates if future acquisitions require materially anisotropic lateral calibration."}],"limitations":["No full image stack was run, as required by the review instructions.","Focused synthetic tests validate rectangles, a tapered polygon, insufficient samples, field propagation, and representative-plane selection; they do not exhaust every concave, branched, or highly self-approaching mask geometry.","The measurement is conditional on the filled U-Net mask and derived centerline. It does not independently validate segmentation boundaries or optical resolution.","The result does not establish chromatin diameter, molecular-scale nucleus width, PSF-corrected width, or anatomical three-dimensional volume."],"recommended_follow_up":["Continue recording segmentation-boundary, focus, annotation-thickness, and lateral-PSF sensitivity wherever body width is reported.","If materially anisotropic XY acquisitions are introduced, add synthetic physical-coordinate tests and replace the scalar XY calibration with axis-specific chord scaling.","Consider adding an explicit synthetic concave-mask case to document nearest-enclosing-intersection behavior."]}